Referring page title,Referring page URL,Links To
"21 Profitable Side Hustles in Singapore: Earn Extra Income—Up to $2,000 a Month in 2024 | StashAway Singapore",https://www.stashaway.sg/r/21-profitable-side-hustles-in-singapore-to-earn-up-to-2000sgd,https://www.daretofinance.com/blog/how-much-do-private-hire-earn-in-singapore/
"21 Profitable Side Hustles in Singapore: Earn Extra Income—Up to $2,000 a Month in 2024 | StashAway Singapore",https://www.stashaway.sg/r/21-profitable-side-hustles-in-singapore-to-earn-up-to-2000sgd,https://daretofinance.com/blog/how-much-do-private-hire-earn-in-singapore/
"21 Profitable Side Hustles in Singapore: Earn Extra Income—Up to $2,000 a Month in 2024 | StashAway Singapore",https://www.stashaway.sg/r/21-profitable-side-hustles-in-singapore-to-earn-up-to-2000sgd,https://daretofinance.com/blog/how-much-do-private-hire-earn-in-singapore
Financing Your Renovation: What are the Options Available? | Qanvast,https://qanvast.com/sg/articles/financing-your-renovation-what-are-the-options-available-3093,https://daretofinance.com/home
Financing Your Renovation: What are the Options Available? | Qanvast,https://qanvast.com/sg/articles/financing-your-renovation-what-are-the-options-available-3093,https://www.daretofinance.com/home
Leveraging Social Media for SEO Success – Tips from iTxoft,https://boost.itxoft.com/common-website-auditing-mistakes-itxoft-4272/,https://daretofinance.com/
"Achieve High Moz DA, Ahrefs DR, and Majestic TF Scores with Expert Link-Building Techniques at Shop.SkyLinkSEO.com. Get Manual SEO Backlinks—See Results First, Pay After Work! – Maximize Your Rankings with Proven Link-Building Expertise at SkyLinkSEO.com",https://seolink.info/see-results-first-pay-later-seo-8985/,https://daretofinance.com/
"Looking for Reliable Backlinks to Boost Your Website Metrics like Ahrefs Dr,Moz Da and Majestic TF? Get High-Quality Guest Posts, PBN Links, and More – No Niche Restrictions All Accepted! See Results First Pay Later! visit Rankva.com – Guest Posts & PBN Links & All Languages or Niches Supported – Pay After Work! visit RankVA.com Or Click here",https://www.crossover-p.com/boost-website-metrics-with-seo-backlinks-refill-guarantee-3-6-12-months-24430/,https://daretofinance.com/
Yin Yang – Ronald Fong,https://ronald-fong.com/portfolio/yin-yang/,https://daretofinance.com/blog/money-dysmorphia-in-singapore/
Yin Yang – Ronald Fong,https://ronald-fong.com/portfolio/yin-yang/,https://daretofinance.com/blog/money-dysmorphia-in-singapore
Yin Yang – Ronald Fong,https://ronald-fong.com/portfolio/yin-yang/,https://www.daretofinance.com/blog/money-dysmorphia-in-singapore/
"Enhance Your Website’s Metrics DA,DR and TF with SEO Backlinks – Pay After You See Results! – Enhance Your Website’s Metrics DA,DR and TF with SEO Backlinks – Pay After You See Results!",https://www.crossover-p.com/boost-website-metrics-with-seo-backlinks-refill-guarantee-3-6-12-months-1257/,https://daretofinance.com/
Dare to Finance founders on giving personal finance advice,https://vulcanpost.com/813436/dare-to-finance-singapore/,https://www.daretofinance.com/
Dare to Finance founders on giving personal finance advice,https://vulcanpost.com/813436/dare-to-finance-singapore/,https://daretofinance.com/
WEB DIRECTORY,https://webby.pages.dev/28/BMqrTtRzYR,https://daretofinance.com/
"What insurance can I get my mum who is 57, does not work, is a foreigner and does not have any insurance at all? - Seedly",https://seedly.sg/posts/what-insurance-can-i-get-my-mum-who-is-57-does-not-work-is-a-foreigner-and-does-not-have-any-insurance-at-all/,https://www.daretofinance.com/blogs/hospital-insurance
❤️ URL Shared ❤️,https://backlinks-checker.com/share/2045968,https://daretofinance.com/
Singapore Personal Finance Podcast – Lyssna här – Podtail,https://podtail.se/podcast/singapore-personal-finance-podcast/,https://daretofinance.com/
Dare To Be Financially Free: She Is Making Personal Finance Less Scary for Millennials and Gen Zs,https://wonderwall.sg/people/dare-to-be-financially-free-sakura-seet,https://daretofinance.com/
"Low SEO Metrics? No Problem – Rankva.com Will Boost Ahrefs DR, Moz DA, and Majestic TF With Quality Backlinks– See Results First, Pay Later, All Niches Accepted with No Worry – The No.1 SEO Agency Trusted by Thousands of Websites Worldwide",https://rankva.com/increase-ahrefs-dr-moz-da-and-majestic-tf-with-seo-backliks-8380/,https://daretofinance.com/
Money Dysmorphia in Singaporean Creatives – Ronald Fong,https://ronald-fong.com/blog/money-dysmorphia-in-singaporean-creatives/,https://daretofinance.com/blog/money-dysmorphia-in-singapore
2025 Guide To Personal Finance Resources In Singapore,https://thesimplesum.we-interactive.com/sg/detail/2025-guide-to-personal-finance-resources-in-singapore,https://daretofinance.com/
Where to buy 🚀 aged domains and backlinks 🔥 from Agmermer | 9356-0521,https://agmermer.pro/9356c052fc1dca92dad508e2175dbbab-domains.html,https://daretofinance.com/
Overcoming Money Dysmorphia for Singaporean Creatives – Ronald Fong,https://ronald-fong.com/blog/overcoming-money-dysmorphia-for-singaporean-creatives/,https://daretofinance.com/blog/money-dysmorphia-in-singapore/
"Boost Your Website Metrics with SEO Backlinks – Pay After Work – Achieve Top Ranking, Rank Higher, Grow Faster – Only with Rankva",https://links4you.info/increase-ahrefs-dr-moz-da-and-majestic-tf-with-seo-backliks-8337/,https://daretofinance.com/
Overcoming Money Dysmorphia for Singaporean Creatives – Ronald Fong,https://ronald-fong.com/blog/overcoming-money-dysmorphia-for-singaporean-creatives/,https://daretofinance.com/blog/money-dysmorphia-in-singapore
Money Dysmorphia in Singaporean Creatives – Ronald Fong,https://ronald-fong.com/blog/money-dysmorphia-in-singaporean-creatives/,https://daretofinance.com/blog/money-dysmorphia-in-singapore/
"Boost Your Website’s Rankings (Moz DA, Ahrefs DR, and Majestic TF) with DoFollow SEO Backlinks and Expert Web Development Services at ROYALSEOHUB.com – royalseohub",https://royalseohub.com/elevate-da-dr-tf-build-websites-results-first-pay-later-8337/,https://daretofinance.com/
"Get tips on how we turned low traffic into big gains, at SeoFlox.com",https://seoflox.io/g/sxfuc-rank-website-on-first-page/,https://daretofinance.com/
Where to buy 🚀 aged domains and backlinks 🔥 from kompromat100 | 0743-9096,https://kompromat100.info/dom-id-f0743909699c2bfc6527a322247967b2.html,https://daretofinance.com/
Where to buy 🚀 aged domains and backlinks 🔥 from sergechel | 1100-8110,https://sergechel.info/list-11008110f399b8d59e23155bb98000c8,https://daretofinance.com/
"Increase backLink building, increase ahrefs rank, moz domain authority, and majestic tf-seoprobox – seoprobox",https://seoprobox.click/increase-backlinks-ahrefs-domain-rating-50-60-70-moz-domain-authority-20-30-and-guest-posting-4254/,https://daretofinance.com/
Where to buy 🚀 aged domains and backlinks 🔥 from Selfie Battles are for amateurs Tim - Kalin from SeoDomains here | 0021-6792,https://selfie-battles-are-for-amateurs-tim--kalin-from-seodomains-here.com/doms-002167921b63e4f4afa34a1ca7726a60.html,https://daretofinance.com/
Where to buy 🚀 aged domains and backlinks 🔥 from faithwebsites | 9128-6033,https://faithwebsites.net/e9c12db8ab603bc34479c811fdf24cc4-domais.html,https://daretofinance.com/
Where to buy 🚀 aged domains and backlinks 🔥 from all-aged-domains | 0021-6792,https://all-aged-domains.com/page-002167921b63e4f4afa34a1ca7726a60.html,https://daretofinance.com/
Types of Online Advertising – How to Market a Business Online | Star Courts,https://starcourts.com/types-of-online-advertising-how-to-market-a-business-online/,https://daretofinance.com/
Create Premium High-Quality backlinks & Increase Ahrefs Domain Rating DR & Increase Domain Authority DA & All Niche backlinks available – High-Quality backlinks,https://linksjump.info/increase-moz-da-ahrefs-dr-and-majestic-tf-with-seo-backliks-19262/,https://daretofinance.com/
Types of Online Advertising – How to Market a Business Online | Development Mi,https://developmentmi.com/types-of-online-advertising-how-to-market-a-business-online/,https://daretofinance.com/
Overcoming Money Dysmorphia for Singaporean Creatives – Ronald Fong,https://ronald-fong.com/blog/overcoming-money-dysmorphia-for-singaporean-creatives/,https://www.daretofinance.com/blog/money-dysmorphia-in-singapore/
"Speedy rankings, proven formula ✨ExLinko.com✨",https://exlinko.org/g/mhkcd-rank-website-in-3-weeks/,https://daretofinance.com/
Money Dysmorphia in Singaporean Creatives – Ronald Fong,https://ronald-fong.com/blog/money-dysmorphia-in-singaporean-creatives/,https://www.daretofinance.com/blog/money-dysmorphia-in-singapore/